{
  "$schema": "../../schemas/rulepack.schema.json",
  "schemaVersion": "1.0.0",
  "id": "community.yy-novel-bar",
  "version": "2026.0.0-seed.1",
  "status": "seed",
  "locale": "zh-CN",
  "title": "YY小说吧雷点与郁闷点（2026 种子包）",
  "description": "用于建立可验证、可选择、可追溯的规则包机制。当前仅少量术语得到观察，尚未完整核验的条目均默认关闭且明确标注为产品候选或占位。",
  "releasedAt": "2026-07-17",
  "supersedes": null,
  "communityContext": {
    "community": "百度贴吧·yy小说吧",
    "scope": "面向该社区特定阅读偏好的小说扫雷与郁闷点提示，不作为作品客观质量评价。",
    "disclaimer": "规则反映可选的社区阅读偏好；系统必须让用户逐条开关和覆写严重度，不得把模型推断或社区偏好表述为客观事实。",
    "expectedCategoryCounts": {
      "landmine": 11,
      "frustration": 21
    }
  },
  "sourceCatalog": [
    {
      "id": "tieba.post.10485825386",
      "kind": "community_post",
      "title": "用户指定的 2026 年规则帖（页面正文与标题仍待完整核验）",
      "uri": "https://tieba.baidu.com/p/10485825386?fr=frs",
      "accessedAt": "2026-07-17",
      "verification": "metadata_only",
      "note": "已知该来源用于雷点/郁闷点规则研究；当前抓取未可靠取得完整正文或图片内容，不能据此声称候选名称就是贴吧原文。"
    },
    {
      "id": "project.requirement.2026-07-17",
      "kind": "user_requirement",
      "title": "项目需求与已确认设计上下文",
      "accessedAt": "2026-07-17",
      "verification": "partially_verified",
      "note": "确认首版需容纳 11 类雷点、21 类郁闷点，且“接盘”概念可能跨两档；具体触发边界仍须回到社区原文逐条核验。"
    }
  ],
  "severityLevels": [
    {
      "id": "critical",
      "label": "致命",
      "rank": 50,
      "description": "用户通常希望立即停扫或显著警告。"
    },
    {
      "id": "high",
      "label": "高",
      "rank": 40,
      "description": "对阅读决定影响很大，但不必自动停止。"
    },
    {
      "id": "medium",
      "label": "中",
      "rank": 30,
      "description": "明显影响体验，适合在报告中突出显示。"
    },
    {
      "id": "low",
      "label": "低",
      "rank": 20,
      "description": "轻度不适或仅在特定读者边界下重要。"
    },
    {
      "id": "info",
      "label": "提示",
      "rank": 10,
      "description": "只做信息披露，不暗示负面评价。"
    }
  ],
  "detectionProfiles": {
    "strict-evidence-v1": {
      "findingStates": ["suspected", "pending_confirmation", "confirmed", "rejected"],
      "minEvidenceSnippets": 1,
      "requiresSourceLocator": true,
      "requiresOriginalTextCheck": true,
      "rules": [
        "confirmed 必须有可回到原文件的章节及段落、页码或行号定位。",
        "传闻、角色误判、梦境、假设句、比喻和模型补全只能进入 suspected 或 pending_confirmation。",
        "后文可能反转的关系事实在全书交叉核验前不得标为 confirmed。",
        "报告需区分原文事实、模型推断和等待后文确认的线索。"
      ]
    }
  },
  "defaults": {
    "unverifiedRulesEnabled": false,
    "defaultFindingState": "suspected",
    "duplicateConceptPolicy": "highest_user_selected_severity",
    "categorySeverity": {
      "landmine": "critical",
      "frustration": "medium"
    }
  },
  "rules": [
    {
      "id": "yy.thunder.accepting-prior-partner",
      "conceptId": "relationship.accepting-prior-partner",
      "version": 1,
      "category": "landmine",
      "name": "接盘（雷点档；定义待核验）",
      "nameStatus": "observed_term_definition_unverified",
      "aliases": ["接盘"],
      "description": "“接盘”术语及跨档现象已在项目上下文中观察到，但雷点档的具体人物范围、关系史与行为阈值尚未按原帖核验。不得仅凭角色有过恋爱史自动判定。",
      "status": "draft",
      "defaultEnabled": false,
      "defaultSeverity": "critical",
      "userConfig": { "toggleable": true, "severityOverride": true, "customBoundaryAllowed": true },
      "detection": {
        "profileRef": "strict-evidence-v1",
        "mode": "semantic",
        "criteria": ["原文给出与目标角色既往或当前亲密关系有关的明确事实，且达到用户自定义的雷点档边界。"],
        "exclusions": ["只有角色传闻、恶意造谣、误会或模型推测。", "仅凭角色存在普通社交或未落实的追求者。"],
        "pendingConditions": ["关系事实尚未揭晓或后文可能澄清。", "用户未设置个人边界且社区原定义尚未核验。"],
        "confirmationScope": "whole_book",
        "requiresUserBoundary": true
      },
      "provenance": {
        "verification": "term_observed",
        "sourceRefs": ["tieba.post.10485825386", "project.requirement.2026-07-17"],
        "note": "术语可用于界面种子；定义在核验原帖前不得标成正式吧规。"
      },
      "tags": ["relationship", "community-term", "cross-category"]
    },
    {
      "id": "yy.thunder.explicit-relationship-betrayal",
      "conceptId": "relationship.explicit-betrayal",
      "version": 1,
      "category": "landmine",
      "name": "候选雷点 02：关系明确背叛",
      "nameStatus": "product_draft",
      "aliases": ["感情背叛", "关系背叛"],
      "description": "产品候选：已建立排他或承诺关系的重要角色主动违背核心感情承诺。非贴吧原文名称。",
      "status": "draft",
      "defaultEnabled": false,
      "defaultSeverity": "critical",
      "userConfig": { "toggleable": true, "severityOverride": true, "customBoundaryAllowed": true },
      "detection": {
        "profileRef": "strict-evidence-v1",
        "mode": "semantic",
        "criteria": ["原文明确存在有效关系承诺。", "角色主动实施与该承诺冲突的感情或亲密行为。"],
        "exclusions": ["关系尚未建立或双方明确允许该行为。", "行为只发生在梦境、幻境、表演或误认中且后文证伪。"],
        "pendingConditions": ["承诺是否有效或行为是否自愿尚未揭晓。"],
        "confirmationScope": "cross_chapter",
        "requiresUserBoundary": true
      },
      "provenance": {
        "verification": "unverified",
        "sourceRefs": ["project.requirement.2026-07-17"],
        "note": "产品候选，等待映射到经核验的社区条目。"
      },
      "tags": ["relationship", "betrayal", "product-draft"]
    },
    {
      "id": "yy.thunder.third-party-intimacy",
      "conceptId": "relationship.third-party-intimacy",
      "version": 1,
      "category": "landmine",
      "name": "候选雷点 03：第三方亲密关系落实",
      "nameStatus": "product_draft",
      "aliases": ["第三方亲密", "关系被介入"],
      "description": "产品候选：核心感情角色与第三方的亲密关系在剧情中被明确落实。非贴吧原文名称。",
      "status": "draft",
      "defaultEnabled": false,
      "defaultSeverity": "critical",
      "userConfig": { "toggleable": true, "severityOverride": true, "customBoundaryAllowed": true },
      "detection": {
        "profileRef": "strict-evidence-v1",
        "mode": "semantic",
        "criteria": ["原文明确给出第三方亲密行为或关系成立，而非只靠暗示推断。"],
        "exclusions": ["亲属、医疗救助、礼仪或伪装行为被断章取义。", "所谓事实在后文被明确否定。"],
        "pendingConditions": ["只有暧昧措辞、转述或场外黑屏，事实未确认。"],
        "confirmationScope": "cross_chapter",
        "requiresUserBoundary": true
      },
      "provenance": {
        "verification": "unverified",
        "sourceRefs": ["project.requirement.2026-07-17"],
        "note": "产品候选，等待社区原定义核验。"
      },
      "tags": ["relationship", "third-party", "product-draft"]
    },
    {
      "id": "yy.thunder.sexual-violence-core-character",
      "conceptId": "harm.sexual-violence-core-character",
      "version": 1,
      "category": "landmine",
      "name": "候选雷点 04：核心角色遭受性暴力",
      "nameStatus": "product_draft",
      "aliases": ["性暴力", "强迫亲密行为"],
      "description": "产品候选：核心角色遭受明确的非自愿性行为或性暴力。非贴吧原文名称。",
      "status": "draft",
      "defaultEnabled": false,
      "defaultSeverity": "critical",
      "userConfig": { "toggleable": true, "severityOverride": true, "customBoundaryAllowed": true },
      "detection": {
        "profileRef": "strict-evidence-v1",
        "mode": "semantic",
        "criteria": ["原文显示行为缺乏有效同意，且行为已实际发生或明确开始实施。"],
        "exclusions": ["只存在威胁但被阻止，且用户边界要求必须实际发生。", "角色扮演或双方同意情境被误读。"],
        "pendingConditions": ["同意状态、行为是否发生或角色身份仍不明确。"],
        "confirmationScope": "cross_chapter",
        "requiresUserBoundary": true
      },
      "provenance": {
        "verification": "unverified",
        "sourceRefs": ["project.requirement.2026-07-17"],
        "note": "产品候选；输出应使用克制、非猎奇措辞。"
      },
      "tags": ["harm", "sexual-violence", "product-draft"]
    },
    {
      "id": "yy.thunder.forced-third-party-union",
      "conceptId": "relationship.forced-third-party-union",
      "version": 1,
      "category": "landmine",
      "name": "候选雷点 05：被迫与第三方成婚或结合",
      "nameStatus": "product_draft",
      "aliases": ["强制婚配", "被迫结合"],
      "description": "产品候选：核心感情角色被迫与第三方建立并落实婚姻或同等级关系。非贴吧原文名称。",
      "status": "draft",
      "defaultEnabled": false,
      "defaultSeverity": "critical",
      "userConfig": { "toggleable": true, "severityOverride": true, "customBoundaryAllowed": true },
      "detection": {
        "profileRef": "strict-evidence-v1",
        "mode": "semantic",
        "criteria": ["存在强制因素。", "婚姻或同等级关系已在剧情事实层面落实。"],
        "exclusions": ["只有订婚安排、威胁或计划，随后在落实前解除。", "为破局而进行的短时伪装且原文明确未成立。"],
        "pendingConditions": ["仪式或关系是否生效要到后文才揭晓。"],
        "confirmationScope": "cross_chapter",
        "requiresUserBoundary": true
      },
      "provenance": {
        "verification": "unverified",
        "sourceRefs": ["project.requirement.2026-07-17"],
        "note": "产品候选，等待社区原定义核验。"
      },
      "tags": ["relationship", "coercion", "product-draft"]
    },
    {
      "id": "yy.thunder.voluntary-affection-transfer",
      "conceptId": "relationship.voluntary-affection-transfer",
      "version": 1,
      "category": "landmine",
      "name": "候选雷点 06：核心感情转向第三方",
      "nameStatus": "product_draft",
      "aliases": ["移情", "转爱他人"],
      "description": "产品候选：已作为核心感情对象的角色自愿、明确地把爱情转向第三方。非贴吧原文名称。",
      "status": "draft",
      "defaultEnabled": false,
      "defaultSeverity": "critical",
      "userConfig": { "toggleable": true, "severityOverride": true, "customBoundaryAllowed": true },
      "detection": {
        "profileRef": "strict-evidence-v1",
        "mode": "semantic",
        "criteria": ["原文明确确认感情性质和对象发生转移。"],
        "exclusions": ["友谊、亲情、崇拜或策略性示好。", "角色被控制、洗脑或冒名，且后文恢复并否认。"],
        "pendingConditions": ["只出现亲近行为而内心与关系性质未确认。"],
        "confirmationScope": "whole_book",
        "requiresUserBoundary": true
      },
      "provenance": {
        "verification": "unverified",
        "sourceRefs": ["project.requirement.2026-07-17"],
        "note": "产品候选，等待社区原定义核验。"
      },
      "tags": ["relationship", "affection-transfer", "product-draft"]
    },
    {
      "id": "yy.thunder.protagonist-gives-up-partner",
      "conceptId": "relationship.protagonist-gives-up-partner",
      "version": 1,
      "category": "landmine",
      "name": "候选雷点 07：主角主动让出核心感情对象",
      "nameStatus": "product_draft",
      "aliases": ["主动让出", "主动放弃感情对象"],
      "description": "产品候选：主角在仍有有效感情关系时主动促成核心对象与第三方结合。非贴吧原文名称。",
      "status": "draft",
      "defaultEnabled": false,
      "defaultSeverity": "critical",